{"base_sha":"f6d9790ecbc8f25739a94a22a42f430a959af737","criteria":[],"language":"python","licence":{"notice_path":null,"path":"LICENSE","spdx_id":"Apache-2.0"},"lockfile_digests":{"uv.lock":"beeacb8bfd8b0bbae0552a5de5d276e267a606733f0f230b62335e389a4401e2"},"merge_sha":"afa7c4a77f21d5106d8af278fa9e588adfc4cdaa","merged_on":"2026-09-04","pull_number":1270,"repository":"usestrix/strix","schema":"specbench.task/1","task_id":"USESTRIX-STRIX-1270","toolchain":{"name":"python","version":"3.13.14"}}
