{"base_sha":"937191701d73e16ae2c55ea869c97d9c984f5414","criteria":[],"language":"go","licence":{"notice_path":null,"path":"LICENSE.md","spdx_id":"MIT"},"lockfile_digests":{"go.mod":"ab33f3d56fd1a574899b1c9942055cbd3e6abfe2cabf54f983dc1ad720ae6af3","go.sum":"0e157d8f872e6943ded68ad8972c01847890724b6bb91fb78f3b22cfef1200ec"},"merge_sha":"0d09452657171581a7492178f9e1a72009002d55","merged_on":"2026-07-15","pull_number":3670,"repository":"IBM/sarama","schema":"specbench.task/1","task_id":"IBM-SARAMA-3670","toolchain":{"name":"go","version":"1.26.4"}}
