{"base_sha":"06b2a678741131fd577ce170e23e5ca0aeba0309","criteria":[],"language":"python","licence":{"notice_path":null,"path":"LICENSE.txt","spdx_id":"BSD-3-Clause"},"lockfile_digests":{"uv.lock":"742507a6bbb80c093d2ebefc073357e3ef0cb504e9299def5348377f0d585d54"},"merge_sha":"2247b35ea1c47c727d7a06e51fa280e12a863ff6","merged_on":"2026-10-04","pull_number":3877,"repository":"pallets/click","schema":"specbench.task/1","task_id":"PALLETS-CLICK-3877","toolchain":{"name":"python","version":"3.13.14"}}
