{"base_sha":"ed1b5e72fa09573779e03d0b62c79c8065f73e2f","criteria":[],"language":"python","licence":{"notice_path":null,"path":"LICENSE","spdx_id":"MIT"},"lockfile_digests":{"uv.lock":"016c25cd436a2e23a15b895e0d2c24b7accd7abc5561bdcd0b29b9e313e25b9a"},"merge_sha":"453e8ca937648bff84a92e78cdb350c015112866","merged_on":"2026-09-01","pull_number":2282,"repository":"teng-lin/notebooklm-py","schema":"specbench.task/1","task_id":"TENG-LIN-NOTEBOOKLM-PY-2282","toolchain":{"name":"python","version":"3.13.14"}}
