{"base_sha":"c39007f4ed4158ac8fadde76527fa0ca7a8b1920","criteria":[],"language":"python","licence":{"notice_path":null,"path":"LICENSE","spdx_id":"MIT"},"lockfile_digests":{"uv.lock":"756a8f72beaa2ee6c0cd31d1d6a46d6055c4335a126bcc8d0686996f36fea0c1"},"merge_sha":"636d9bc682343cc431401d2f43598c4052d1c2a7","merged_on":"2026-09-12","pull_number":2416,"repository":"MemPalace/mempalace","schema":"specbench.task/1","task_id":"MEMPALACE-MEMPALACE-2416","toolchain":{"name":"python","version":"3.12.15"}}
