{"base_sha":"b871c9aec92b0bfb3698d70ba1d4d829b17c929c","criteria":[],"language":"go","licence":{"notice_path":"NOTICE","path":"LICENSE","spdx_id":"Apache-2.0"},"lockfile_digests":{"go.mod":"775ad91b3e3ef8bdcf92bd2de0acb1db7f6bcb1b7f0fa0b4f010a7da22e5c295","go.sum":"35de5edf7975916c1ae93552e4836531af4ea0c509a67a2562d98742f460d9d4"},"merge_sha":"9eaa4a4d2fbea6dbb9169bafc06f07e242408fb5","merged_on":"2026-08-26","pull_number":8476,"repository":"cadence-workflow/cadence","schema":"specbench.task/1","task_id":"CADENCE-WORKFLOW-CADENCE-8476","toolchain":{"name":"go","version":"1.26.4"}}
